{
  "schema_version": "1.0",
  "run_id": "c7736d4e6a814b9182d5fc0904d0d266",
  "status": "blocked",
  "binding": {
    "target_repo": "C:/Users/mdibr/Desktop/LabLab/IBM Bob Hackathon/ibm-bob2.0-hackathon-2026/invariant-demo-nsclc",
    "target_repo_name": "invariant-demo-nsclc",
    "head_sha": "873d00942f38b9c92681d9f430c352fcfc7cba8a",
    "base_sha": "e739727886a3dd69a2c2733a97877754a0cfee28",
    "base_sha_source": "invariant.toml",
    "hashes": {
      "invariant.toml": "017d737163f27bdf72eab7b1cebd43f048eb872de298ade3cb97ff33e673128a",
      "configs/data_generation.json": "5d9eb59028f68955ca7a02b12d9453c9ad55caa461b4863aca27d8139f0015e5",
      "data/image_manifest.json": "327ce4868f05975c99e8ed996afa9a410f92bb5e70d06c16d72f721175cc0568",
      "docs/study_protocol.pdf": "6559268288013181fbe47f616c70f6b03ca71ba66df9ee2cc6317be422ad4473",
      "data/metadata.csv": "aff30de03f8c87ca750c1752678069f1c3cd33d06703ae86c5c9e5ff2815dce0"
    },
    "analyzer_commit": "ee0bb7c880483419e04895ac762119d5c0f6ed07",
    "required_checks": [
      "verify_split_overlap",
      "regression_tests",
      "find_invariant_tests",
      "inspect_split"
    ],
    "completed_checks": [
      "verify_split_overlap",
      "regression_tests",
      "find_invariant_tests",
      "inspect_split"
    ]
  },
  "checks": {
    "verify_split_overlap": {
      "contribution": "blocked",
      "summary": "state=valid overlap_count=166",
      "result": {
        "state": "valid",
        "partition_errors": [],
        "overlap_count": 166,
        "overlap_examples": [
          "NSCLC_P001",
          "NSCLC_P002",
          "NSCLC_P003",
          "NSCLC_P004",
          "NSCLC_P005"
        ],
        "train_group_count": 200,
        "test_group_count": 166,
        "rows_partitioned": 1600,
        "split_seed": 0
      }
    },
    "regression_tests": {
      "contribution": "review_required",
      "summary": "error: configured test paths not found: ['tests/test_split_invariants.py']",
      "result": {
        "state": "collection_error",
        "error": "configured test paths not found: ['tests/test_split_invariants.py']",
        "passed": 0,
        "failed": 0,
        "errors": 0,
        "skipped": 0,
        "collected": 0
      }
    },
    "find_invariant_tests": {
      "contribution": "review_required",
      "summary": "state=no_recognized_guard",
      "result": {
        "state": "no_recognized_guard",
        "evidence": [],
        "split_function": "demo_repo.splits:make_split",
        "group_key": "patient_id",
        "test_files_scanned": 5
      }
    },
    "inspect_split": {
      "contribution": "none",
      "summary": "risk_indicators=['row_level_split_with_group_key_in_metadata']",
      "result": {
        "file": "demo_repo/splits.py",
        "split_function": "demo_repo.splits:make_split",
        "group_key": "patient_id",
        "function_line": 4,
        "calls": [
          {
            "line": 6,
            "call": "train_test_split",
            "stratify": "label"
          }
        ],
        "group_aware": false,
        "stratify_col": "label",
        "identity_columns": [
          "slice_id",
          "patient_id",
          "study_id"
        ],
        "risk_indicators": [
          "row_level_split_with_group_key_in_metadata"
        ]
      }
    }
  },
  "invariants": {
    "patient_independence": {
      "status": "checked"
    },
    "train_only_fitting": {
      "status": "not_checked"
    },
    "inference_consistency": {
      "status": "not_checked"
    }
  },
  "history": {
    "confirmed_affected": [
      "14501090193f408ab4e233a21a90b829",
      "25c6042ec0024cee9bdb5e3277f842c9",
      "2e570326403f4ccd9a124257fdd3e0c2",
      "5aac48aa31594688b995602809dad6ea",
      "6f4dcb0f1a414dfcb2164e143b8de84d",
      "76b0d2dcbafc49d5ab6475efd794ed13",
      "8e6deb346cc54eadb8e171d9c591d8bb",
      "9b62a7496cf64ada986747b3841e42f4",
      "a50d4322067f44d8940388ac30184164",
      "dc5f11d6a819434d811cf23573ad54ac"
    ],
    "potentially_affected": [],
    "confirmed_count": 11,
    "potentially_count": 0,
    "cpu_time_seconds": 7.906,
    "wall_time_seconds": 9.364,
    "timing_boundary_values": [
      null,
      "split + partition validation + feature preparation (array load and block means) + fit + prediction + evaluation; excludes image-manifest verification, MLflow logging and manifest writing"
    ],
    "missing_timing_count": 0,
    "truncated": true
  },
  "explanation_md": "## Finding: Patient-level train/test leakage \u2014 INV-1 violated\n\n`demo_repo/splits.py:make_split` calls `sklearn.model_selection.train_test_split` at the **row level** without grouping by `patient_id`. Because each patient contributes 8 slices, rows from the same patient are independently assigned to train or test, so a patient can (and does) appear in both partitions.\n\n`verify_split_overlap` (seed 0, 1 600 rows, 200 patients) measured **overlap_count = 166**: 166 of the 200 patients have slices in both the training set and the test set. Example overlapping patients: NSCLC_P001, NSCLC_P002, NSCLC_P003, NSCLC_P004, NSCLC_P005.\n\nThe persistent patient texture engineered into the synthetic images (see protocol \u00a73) means the model can memorise per-patient appearance from training slices and transfer that signal to the test slices of the same patient, inflating the reported ROC AUC.\n\n`find_invariant_tests` returned `no_recognized_guard`: no test in tests/ asserts disjoint patient sets between train and test, so the defect has been undetected.\n\n`inspect_split` confirms `group_aware=false` and risk indicator `row_level_split_with_group_key_in_metadata`.\n\nINV-2 (train_only_fitting) and INV-3 (inference_consistency) are **not_checked** in this review.",
  "remediation_md": "## Remediation\n\nReplace `train_test_split` with `GroupShuffleSplit(n_splits=1, test_size=test_size, random_state=seed)` grouped on the `patient_id` column. This ensures every patient's slices appear in exactly one partition.\n\nConcrete change in `demo_repo/splits.py`:\n\n```python\nfrom sklearn.model_selection import GroupShuffleSplit\n\ndef make_split(df, seed, test_size=0.2):\n    gss = GroupShuffleSplit(n_splits=1, test_size=test_size, random_state=seed)\n    train_idx, test_idx = next(gss.split(df, groups=df[\"patient_id\"]))\n    return df.index[train_idx], df.index[test_idx]\n```\n\nAdd `tests/test_split_invariants.py` with:\n1. A fixed fixture of 20 patients \u00d7 3 slices each (60 rows).\n2. A domain test asserting that the patient sets of the two returned index arrays are disjoint.\n3. A Hypothesis property test over variable patient counts and test sizes that asserts the same disjointness property."
}