{
  "schema_version": "1.0",
  "run_id": "b82ed8505f6a4c408660223e1b86bfe0",
  "status": "no_findings",
  "binding": {
    "target_repo": "C:/Users/mdibr/Desktop/LabLab/IBM Bob Hackathon/ibm-bob2.0-hackathon-2026/invariant-demo-nsclc",
    "target_repo_name": "invariant-demo-nsclc",
    "head_sha": "555dd62b8d1b9beebdaf67a2eb468c4a37094ee1",
    "base_sha": "e739727886a3dd69a2c2733a97877754a0cfee28",
    "base_sha_source": "invariant.toml",
    "hashes": {
      "invariant.toml": "017d737163f27bdf72eab7b1cebd43f048eb872de298ade3cb97ff33e673128a",
      "configs/data_generation.json": "5d9eb59028f68955ca7a02b12d9453c9ad55caa461b4863aca27d8139f0015e5",
      "data/image_manifest.json": "327ce4868f05975c99e8ed996afa9a410f92bb5e70d06c16d72f721175cc0568",
      "docs/study_protocol.pdf": "6559268288013181fbe47f616c70f6b03ca71ba66df9ee2cc6317be422ad4473",
      "data/metadata.csv": "aff30de03f8c87ca750c1752678069f1c3cd33d06703ae86c5c9e5ff2815dce0"
    },
    "analyzer_commit": "ee0bb7c880483419e04895ac762119d5c0f6ed07",
    "required_checks": [
      "verify_split_overlap",
      "regression_tests",
      "find_invariant_tests",
      "inspect_split"
    ],
    "completed_checks": [
      "verify_split_overlap",
      "regression_tests",
      "find_invariant_tests",
      "inspect_split"
    ]
  },
  "checks": {
    "verify_split_overlap": {
      "contribution": "none",
      "summary": "state=valid overlap_count=0",
      "result": {
        "state": "valid",
        "partition_errors": [],
        "overlap_count": 0,
        "overlap_examples": [],
        "train_group_count": 160,
        "test_group_count": 40,
        "rows_partitioned": 1600,
        "split_seed": 0
      }
    },
    "regression_tests": {
      "contribution": "none",
      "summary": "state=passed passed=4 failed=0 collected=4",
      "result": {
        "state": "passed",
        "passed": 4,
        "failed": 0,
        "errors": 0,
        "skipped": 0,
        "collected": 4
      }
    },
    "find_invariant_tests": {
      "contribution": "none",
      "summary": "state=recognized_guard",
      "result": {
        "state": "recognized_guard",
        "evidence": [
          "tests/test_split_invariants.py:46",
          "tests/test_split_invariants.py:77"
        ],
        "split_function": "demo_repo.splits:make_split",
        "group_key": "patient_id",
        "test_files_scanned": 6
      }
    },
    "inspect_split": {
      "contribution": "none",
      "summary": "risk_indicators=[]",
      "result": {
        "file": "demo_repo/splits.py",
        "split_function": "demo_repo.splits:make_split",
        "group_key": "patient_id",
        "function_line": 4,
        "calls": [
          {
            "line": 10,
            "call": "GroupShuffleSplit"
          },
          {
            "line": 11,
            "call": "split",
            "groups": "patient_id"
          }
        ],
        "group_aware": true,
        "stratify_col": null,
        "identity_columns": [
          "slice_id",
          "patient_id",
          "study_id"
        ],
        "risk_indicators": []
      }
    }
  },
  "invariants": {
    "patient_independence": {
      "status": "checked"
    },
    "train_only_fitting": {
      "status": "not_checked"
    },
    "inference_consistency": {
      "status": "not_checked"
    }
  },
  "history": {
    "confirmed_affected": [
      "14501090193f408ab4e233a21a90b829",
      "25c6042ec0024cee9bdb5e3277f842c9",
      "2e570326403f4ccd9a124257fdd3e0c2",
      "5aac48aa31594688b995602809dad6ea",
      "6f4dcb0f1a414dfcb2164e143b8de84d",
      "76b0d2dcbafc49d5ab6475efd794ed13",
      "8e6deb346cc54eadb8e171d9c591d8bb",
      "9b62a7496cf64ada986747b3841e42f4",
      "a50d4322067f44d8940388ac30184164",
      "dc5f11d6a819434d811cf23573ad54ac"
    ],
    "potentially_affected": [],
    "confirmed_count": 11,
    "potentially_count": 0,
    "cpu_time_seconds": 7.906,
    "wall_time_seconds": 9.364,
    "timing_boundary_values": [
      null,
      "split + partition validation + feature preparation (array load and block means) + fit + prediction + evaluation; excludes image-manifest verification, MLflow logging and manifest writing"
    ],
    "missing_timing_count": 0,
    "truncated": true
  },
  "explanation_md": "## Changes since Report A (run c7736d4e, head 873d009, status: blocked)\n\n**What changed:**\n- `demo_repo/splits.py`: replaced `train_test_split` (row-level, no grouping) with `GroupShuffleSplit(n_splits=1, test_size=test_size, random_state=seed)` grouped on `patient_id`. All slices of a patient now land in exactly one partition, satisfying INV-1.\n- `tests/test_split_invariants.py` (new file): adds a `patient_overlap` helper function that computes the intersection of patient sets across partitions; a fixed 20\u00d73 fixture; domain tests for disjointness, full coverage, and non-emptiness; and a Hypothesis property test over variable patient/slice/seed/test_size combinations. The disjointness assertion is routed through `patient_overlap` so Invariant's guard detector recognises it.\n\n**Why the checks now pass:**\n- `verify_split_overlap`: overlap_count dropped from 166 to **0** \u2014 no patient appears in both train (160 patients) and test (40 patients).\n- `find_invariant_tests`: now `recognized_guard` \u2014 evidence at `tests/test_split_invariants.py:46` and `:77`.\n- `regression_tests`: all 4 tests pass (was: file not found in Report A).\n- `inspect_split` risk indicator remains as a static note but the measured finding is resolved.",
  "remediation_md": "No further remediation required for INV-1. INV-2 (train_only_fitting) and INV-3 (inference_consistency) remain not_checked and are out of scope for this PR."
}